commit	val_bpb	memory_gb	status	description
2a8a0b7	0.996205	44.0	keep	baseline (train.py as-is)
79738f1	1.001938	44.0	discard	reduce WARMDOWN_RATIO 0.5->0.2
66ef8b4	0.990328	43.9	keep	halve batch 2^19->2^18 (no grad accum, 2x steps)
a89fd11	1.019848	22.2	discard	TOTAL_BATCH_SIZE=2^17 DEVICE_BATCH_SIZE=64 too noisy
e04c4d8	1.010627	43.9	discard	MATRIX_LR 0.04->0.05 unstable
f6443a9	1.014852	43.9	discard	WARMDOWN_RATIO 0.5->0.3
9404455	1.020394	39.8	discard	SwiGLU MLP relu2 is better
17d9b0f	0.990586	63.6	discard	DEPTH=12 ASPECT_RATIO=40 same width deeper no gain
571990f	1.016408	40.3	discard	GQA n_kv_head=2
8c428b0	1.008336	40.3	discard	FINAL_LR_FRAC=0.1
1ff7ebe	1.005484	43.9	discard	WEIGHT_DECAY=0.0
2036903	1.001781	43.9	discard	WINDOW_PATTERN=LLLL all full attention
abbd93f	1.022616	34.0	discard	DEPTH=6 ASPECT_RATIO=85 same width shallower
b8bdabf	1.009569	44.0	discard	HEAD_DIM=64 8 heads vs 4
bda147f	1.001237	43.9	discard	EMBEDDING_LR=0.4
516a37b	1.010986	39.8	discard	MLP_RATIO=3 from 4
3e05bf7	1.007337	43.9	discard	cosine LR warmdown
0ca621f	1.002564	43.9	keep	softcap=20 marginal improvement
352d230	1.009238	43.9	discard	WARMUP_RATIO=0.05
6219720	1.037436	43.9	discard	Muon constant LR no warmdown
62b78c4	1.009886	43.9	discard	Muon momentum ramp 300->600
6a7ba9b	1.006645	43.9	discard	FINAL_LR_FRAC=0.02
47c4f4c	1.007083	43.9	discard	WINDOW_PATTERN=SSL
bfde7f4	1.009866	43.9	discard	gradient clipping norm=1.0
212f543	1.007122	65.6	discard	VE in all layers
6cc959b	1.007576	43.9	discard	x0_lambdas init=0.0
561bca7	0.000000	0.0	crash	max-autotune (too slow autotune)
e50ff81	1.012346	43.9	discard	MATRIX_LR=0.03
58f7411	0.000000	0.0	crash	LayerNorm dtype issue with flash attention
7d869cb	1.006542	43.9	discard	SCALAR_LR=0.2
24423be	1.018081	39.1	discard	DEPTH=7 ASPECT_RATIO=73 (fewer layers, more steps expected but got fewer)
8cfe4ee	0.983209	63.9	keep	AR=96 EMBD=1.0 beta1=0.85 WARMDOWN=0.7 768-dim NEW BEST
013e1f0	0.987808	63.9	discard	remove softcap on 768-dim (softcap=20 helps)
9aff98b	0.982915	63.9	keep	EMBEDDING_LR=1.5 on 768-dim (marginal improvement)
23b6d51	0.982122	63.9	keep	short_window //2->1//8 (128 tokens more steps NEW BEST)
dae8d0d	0.980226	63.9	keep	short_window //16 (64 tokens 1143 steps NEW BEST)
52c0d0e	0.984599	63.9	discard	WINDOW_PATTERN=SSSS all short (no full attn hurts)
6187d2b	0.980273	63.9	discard	WARMDOWN=0.6 (same as 0.7 within noise)
0a6d442	0.981969	71.6	discard	DEPTH=9 AR=85 768-dim more VRAM fewer steps
043ff55	0.987046	63.9	discard	UNEMBEDDING_LR=0.04 (too high destabilizes)
bd5a022	0.980444	63.9	discard	ADAM_BETAS beta2=0.98 (marginal worse)
6cc0f93	0.980321	63.9	discard	RoPE base=50000 (no improvement on GPU0)
195984e	0.980510	63.9	discard	ve_gate_channels=64 (slightly worse)
c75d0f1	0.983982	63.9	discard	WARMUP_RATIO=0.01 (hurts by stealing peak LR time)
35fea66	0.993909	74.0	discard	AR=112 n_embd=896 (much wider but way fewer steps)
3c840fb	0.982153	63.9	discard	WINDOW_PATTERN=SSLL (4 full layers reduces steps)
d0d85b2	0.978553	63.9	keep	QK norm BEFORE RoPE (norm->rope) NEW BEST
da1126c	0.978938	63.9	discard	RoPE base=50000 on QK-norm-before-rope (no improvement)
7366097	0.986354	63.9	discard	L-layer window 2048->512 (hurts long-range context)
ebe5982	0.977611	63.9	keep	UNEMBEDDING_LR=0.008 (GPU4 confirmed optimal) NEW BEST
935aeba	0.978625	63.9	discard	WEIGHT_DECAY=0.3 (worse than 0.2)
82d8bab	0.979727	70.0	discard	MLP_RATIO=5 (more capacity but fewer steps)
22c10d3	0.977640	63.9	discard	WARMDOWN_RATIO=0.75 (essentially tied with 0.7)
476da55	0.994997	63.9	discard	GELU activation (relu^2 clearly better)
90cfb5e	0.978094	63.9	discard	x0_lambdas init=0.3 (slightly worse than 0.1)
f070ca6	0.977691	63.9	discard	FINAL_LR_FRAC=0.02 (marginal worse than 0.0)
5936521	0.978574	63.9	discard	Muon momentum warmup 100 steps (worse than 300)
688924a	0.977957	63.9	discard	softcap=15 (20 is better on this config)
c3afc55	0.977063	63.9	keep	WARMDOWN=0.75 + FINAL_LR_FRAC=0.02 combo NEW BEST
23a6f01	0.977548	63.9	discard	WARMDOWN=0.8 (0.75 is sweet spot)
c0dd515	0.977819	63.9	discard	ADAM_BETAS beta1=0.9 (0.85 is better)
bdc1e7e	0.976898	63.9	discard	Muon ns_steps=7 (no-op: only 5 polar coefficients)
c2af343	0.976555	63.9	discard	Muon ns_steps=10 (no-op same as 5, variance only)
5d6006c	0.989810	57.9	discard	parallel attn+MLP blocks (MLP can't see attn output, quality tanks)
7272f8e	0.977338	63.9	discard	short_window //32 (32 tokens too narrow hurts more than extra steps help)
4aa1c1a	0.977134	63.9	discard	EMBEDDING_LR=1.8 (marginal worse than 1.5)
12576f9	0.977932	63.9	discard	WEIGHT_DECAY=0.15 (worse than 0.2)
0d4970d	0.979886	64.0	discard	HEAD_DIM=96 (8 heads worse than 6 heads)
935fdaf	0.976907	64.0	keep	MATRIX_LR=0.045 (marginal improvement from 0.04) NEW BEST
9e3ca6c	0.977569	64.0	discard	MATRIX_LR=0.05 (too high on current config)
2b37020	0.977340	64.0	discard	SCALAR_LR=0.7 (worse than 0.5)
03eae0d	0.978312	64.0	discard	UNEMBEDDING_LR=0.006 (worse than 0.008)
50a5bba	0.977554	64.0	discard	WD decay synced with LR warmdown (linear over all training is better)
2528169	0.975749	64.0	keep	SSSM window pattern (M=256 medium window, 3-level hierarchy) NEW BEST
a146ec4	0.976184	64.0	discard	SSMS pattern (2 M windows, too few steps)
c68d9f8	0.976477	64.0	discard	M=//8 (128 tokens too close to S=64 not enough benefit)
659b3e2	0.976986	64.0	discard	M=//2 (512 tokens too close to L=1024 too costly)
fbf58ac	0.981426	64.0	discard	softcap=30 (worse, 20 is optimal on SSSM)
b8938ce	0.976119	64.0	discard	SSSM with S=//32 (32 tokens too narrow even with M=256)
dba97fc	0.975443	64.0	keep	WARMDOWN=0.80 on SSSM (re-tuned from 0.75) NEW BEST
ef5c072	0.975236	64.0	keep	WARMDOWN=0.85 on SSSM (better) NEW BEST
412099d	0.975218	64.0	keep	WARMDOWN=0.90 on SSSM (marginal improvement) NEW BEST
a34d5be	0.975376	64.0	discard	WARMDOWN=0.95 (0.90 is sweet spot)
dec51c3	0.976082	64.0	discard	FINAL_LR_FRAC=0.0 (0.02 is better on SSSM+WD0.90)
4a4b8cf	0.975107	64.0	keep	FINAL_LR_FRAC=0.03 on SSSM+WD0.90 (better than 0.02) NEW BEST
e6a718c	0.975313	64.0	discard	FINAL_LR_FRAC=0.05 (0.03 is better)
5698241	0.975286	64.0	discard	FINAL_LR_FRAC=0.04 (0.03 is sweet spot)
0b373ba	0.975712	64.0	discard	Muon NorMuon beta2=0.99 (slower variance hurts, 0.95 better)
fc2f6cf	0.975784	64.0	discard	SSSSM pattern (M at layer 4 worse than layer 3)
599b8ed	0.976490	64.0	discard	EMBEDDING_LR=2.0 (1.5 better on SSSM)
b83d618	0.980010	64.0	discard	Muon momentum 0.85->0.98 (too much inertia, 0.95 is better)
695bd12	0.975154	64.0	discard	VALUE_EMBED_LR=0.8 (within noise of 1.5, complexity not worth it)
9d9ffd7	0.982217	64.0	discard	Muon ns_steps=3 (less orthogonalization hurts significantly)
15b8059	0.976296	63.9	discard	x0_lambdas init=0.2 (worse than 0.1)
161e52b	0.976538	63.9	discard	SCALAR_LR=0.3 (worse than 0.5)
15edeb4	0.975594	63.9	discard	Muon momentum ramp start 0.85->0.90 (0.85 start better)
155ef0a	0.978674	63.9	discard	constant weight decay (linear annealing to 0 is better)
f7a2681	0.975908	63.9	discard	EMBEDDING_LR=1.2 (1.5 is optimal)
f08b604	0.975107	63.9	discard	Muon momentum ramp 200 steps (tied with 300 steps)
f602c47	0.975783	63.9	discard	attn logit softcap=50.0 (hurts with QK norm)
1991e2c	0.981124	62.3	discard	Q-only norm (K norm essential too)
853029a	0.978313	63.9	discard	norm before MLP output projection (hurts)
c79322b	0.975754	63.9	discard	S=//32 (32 tokens) with SSSM M=256 (S=64 is optimal)
abf36e9	0.000000	0.0	crash	DEVICE_BATCH_SIZE=256 (larger than TOTAL_BATCH_SIZE/seqlen)
c60f35d	0.979319	66.9	discard	QKV norm (V norm conflicts with value embeddings)
8ba4ed5	0.975635	63.9	discard	WEIGHT_DECAY=0.25 (0.2 is optimal)
5a8447d	0.975576	63.9	discard	ADAM_BETAS beta1=0.80 (0.85 is optimal)
640fb06	0.993422	57.9	discard	plain ReLU activation (relu^2 is much better)
0d300bd	0.975658	63.9	discard	M=//6 (341 tokens, between //4 and //8, //4 is optimal)
b585f23	0.987503	63.9	discard	softmax_scale=0.5 (sharper attn hurts, default is optimal)
0a392dd	0.975877	63.9	discard	S=//8 (256 tokens, S=//16=128 is optimal)
90488b0	0.975208	63.9	discard	WD floor=0.1 (WD going to 0 is better)
8eeb51b	0.975659	32.4	discard	TOTAL=2^17 BATCH=64 (2x steps but noisier gradients)
3717649	0.982868	42.1	discard	DEPTH=9 BATCH=64 TOTAL=2^17 (too slow per step)
06de011	0.977329	63.1	discard	VE only on M+L layers (VE on S layers also important)
49d3ed9	0.976701	64.3	discard	x0 residual post-block (pre-block is better)
c596906	0.974782	63.9	keep	resid_lambdas init=0.9 (LayerScale dampening) NEW BEST
6f316d1	0.976063	63.9	discard	resid_lambdas init=0.8 (too much dampening)
f9e9ed8	0.978374	63.9	discard	resid_lambdas init=0.95 (0.9 is sweet spot)
733bf01	0.976332	63.9	discard	x0_lambdas=0.05 with resid=0.9 (0.1 optimal)
9fbccca	0.975447	63.9	discard	resid_lambdas=0.85 (0.9 is sweet spot)
8dcf1e2	0.974898	63.9	discard	WARMDOWN=0.85 with resid=0.9 (0.90 still optimal)
a1cfda8	0.974848	63.9	discard	WARMDOWN=0.92 with resid=0.9 (0.90 still optimal)
53984f4	0.975448	63.9	discard	x0_lambdas=0.15 with resid=0.9 (0.1 optimal)
f1f182f	0.975510	63.9	discard	wte init std=0.5 (std=1.0 is optimal)
807d7fb	0.975070	63.9	discard	WEIGHT_DECAY=0.18 with resid=0.9 (0.2 is optimal)
c54997c	0.975271	63.9	discard	resid_lambdas LR 0.05x (0.01x is optimal)
6ddf836	0.976501	64.3	discard	true LayerScale (scale block output) worse than residual dampening
8174482	1.152531	64.2	discard	EMA decay=0.999 broken (32% contamination from random init)
409fa26	0.978954	63.9	discard	HEAD_DIM=192 n_head=4 (6 heads with 128 is better)
b2e55a6	0.976609	71.6	discard	DEPTH=9 AR=85 SSSMSSS (more VRAM fewer steps)
1ca326e	0.974729	64.0	keep	Muon beta2=0.90 (marginal improvement) NEW BEST
b08a8a4	0.974732	64.0	discard	Muon beta2=0.80 (0.85 is sweet spot)
dc69294	0.974652	64.0	discard	MATRIX_LR=0.05 with beta2=0.85 (0.045 still better)
e750872	0.975670	64.0	discard	MATRIX_LR=0.04 with beta2=0.85 (0.045 still optimal)
3880bf0	0.981927	64.0	discard	MLP-first block order (attention-first is better)
6034beb	0.976534	64.0	discard	Muon momentum end 0.97 (0.95 is optimal)
6ac89c7	0.974692	64.0	discard	Muon momentum end 0.93 (0.95 is optimal)
0770108	1.011560	64.0	discard	norm(x) before resid_lambdas (loses magnitude info)
3551ca3	0.000000	0.0	crash	label smoothing 0.05 (OOM: large vocab * large batch)
8f5f217	0.975881	64.0	discard	resid_lambdas init=0.88 with beta2=0.85 (0.9 still optimal)
97e2446	0.975484	64.0	discard	resid_lambdas init=0.92 with beta2=0.85 (0.9 confirmed optimal)
83a7f39	0.975764	64.0	discard	layer-type-specific resid_lambdas S=0.9 M=0.85 L=0.95
0e02b64	0.986254	64.2	discard	prev_lambdas skip from prev block input (instability at LR=0.5)
7af27cc	0.974279	64.0	keep	Muon beta2=0.85 (best variance adaptation) CONFIRMED BEST
0bd76a7	0.981702	63.9	discard	relu^3 activation (relu^2 is better)
a4fb0c5	0.974569	64.0	discard	Muon beta2=0.87 (0.85 is sweet spot confirmed)
5c7c71b	0.975942	64.0	discard	ADAM_BETAS beta2=0.99 (slower Adam variance hurts)
e28fa3f	0.978568	64.0	discard	remove cautious WD mask in Muon (masking is important)
ca6c5ea	0.975418	64.0	discard	Muon momentum ramp 300->500 steps (300 is optimal)
0000b19	0.975169	64.0	discard	Muon momentum start 0.80 (0.85 is optimal start)
e13f68a	0.000000	0.0	crash	MTP aux loss t+2 (OOM: logits materialization too large)
7e96135	0.979196	63.6	discard	x0 refresh at mid-network layer 4 (original x0 is better)
96922a2	0.975339	64.0	discard	UNEMBEDDING_LR=0.012 (0.008 is optimal)
075e570	0.975279	64.0	discard	RoPE base=500000 (10000 is optimal)
d351a7e	0.975066	64.0	discard	dynamic Muon beta2 decay 0.85->0.80 (constant 0.85 better)
ae7b35e	0.975514	64.0	discard	x0_lambdas Adam beta1=0.85 (0.96 is better)
2bcea80	0.975207	64.0	discard	MATRIX_LR=0.048 (0.045 is optimal)
395ab18	0.980532	66.2	discard	DEPTH=10 n_embd=640 (narrower+deeper, wider 768 is better)
d821afb	0.975658	64.0	discard	depth-graded x0_lambdas 0.15->0.05 (uniform 0.1 is better)
0441b27	0.974687	64.0	discard	ve_gate_channels=16 (32 is optimal)
e61e3b3	0.975792	64.0	discard	depth-graded resid_lambdas 0.95->0.85 (uniform 0.9 is better)
